{
  "access_delta_without_action_change_count": 20,
  "accessible_evidence_changed_transition_count": 20,
  "action_and_witness_changed_transition_count": 0,
  "action_and_witness_stable_transition_count": 10,
  "action_changed_transition_count": 20,
  "action_changed_with_access_delta_count": 0,
  "action_changed_without_access_delta_count": 20,
  "action_changed_without_witness_delta_count": 20,
  "admission_gate_changed": false,
  "as_of_date_changed_transition_count": 2,
  "audit_id": "adds-frontier-oracle-transition-audit-v1",
  "baseline_model_runs_started": false,
  "benchmark_evidence_claimed": false,
  "blocker_action_delta_alignment_pass_count": 50,
  "blocker_changed_transition_count": 20,
  "board_admitted_count": 0,
  "board_id": "adds-frontier-private-pilot-v1",
  "canonical_transition_count": 50,
  "canonical_transition_coupling_coverage_ready": false,
  "causal_review_trigger": "action_and_access_deltas_exist_but_no_transition_contains_both",
  "challenge_assignment_authorized": false,
  "compiled_on": "2026-08-23",
  "disposition_changed_transition_count": 4,
  "evidence_action_coupling_review_required": true,
  "expert_solve_gate_changed": false,
  "human_transition_review_required": true,
  "integrity_sha256": "339cc838051efff746a2af334e88b15bcffd1f2a8223ef4cbf354545d2e5059e",
  "new_accessible_evidence_item_count": 20,
  "next_action_changed_transition_count": 20,
  "nonclaims": [
    "Machine diagnostics cannot revise author oracles or satisfy human review and challenge gates.",
    "No challenge assignment, model run, benchmark result, or board admission is authorized.",
    "No private task, oracle, evidence identity, stage transition, gate set, or review payload is public.",
    "Stage-kind and gate progression may explain action changes but are not causal evidence by themselves.",
    "Structural transition classes do not establish that an action or witness change is scientifically justified.",
    "Zero observed action/evidence coupling is a canonical-trajectory coverage gap, not proof of causal inconsistency."
  ],
  "oracle_revision_applied": false,
  "oracle_support_ready_for_independent_challenge": false,
  "private_payload_published": false,
  "private_report_commitment": "e5700a2dd03d6cd46f318b1ba427cbcc63499c17eb607c89c55f71f664f63814",
  "protocol_id": "adds-frontier-v1",
  "public_fragility_summary_integrity_sha256": "288567c43036fb4f4d3ab93edd9388fa3ec13d27c683e64e9ee467032708fa31",
  "public_preflight_integrity_sha256": "9e195e7a5e7ccfeefca8b195202354262901fe93778fbf4085cecf55ba5a2027",
  "public_support_curation_summary_integrity_sha256": "9c82d437f6c5b4b28395e41498f50d50278dd9c2cd3a14bee80aa25e6149d65e",
  "removed_accessible_evidence_item_count": 0,
  "required_gate_set_changed_transition_count": 50,
  "risk_flags_changed_transition_count": 8,
  "schema_version": "adds.frontier-oracle-transition-audit-summary.v1",
  "scientific_causality_established": false,
  "status": "machine_audit_complete_causal_discriminability_review_required",
  "task_count": 10,
  "transition_classification_rule": "classify_exact_action_and_witness_set_deltas_between_adjacent_canonical_stages",
  "witness_access_delta_alignment_pass_count": 50,
  "witness_changed_transition_count": 20,
  "witness_changed_without_action_delta_count": 20
}
